{
  "$schema": "http://json-schema.org/draft-07/schema#",
  "title": "Training Run Schema",
  "description": "A single training run validation result for the idud system",
  "type": "object",
  "properties": {
    "run_id": {
      "type": "string",
      "format": "uuid",
      "description": "Unique identifier for this training run"
    },
    "timestamp": {
      "type": "string",
      "format": "date-time",
      "description": "ISO 8601 timestamp when this run was executed"
    },
    "repo_url": {
      "type": "string",
      "description": "HTTPS URL of the repository tested"
    },
    "batch_id": {
      "type": "string",
      "description": "Batch identifier (groups multiple runs)"
    },
    "issue_id": {
      "type": "string",
      "description": "Unique identifier for the test case (issue or scenario)"
    },
    "issue_text": {
      "type": "string",
      "description": "The issue description or problem statement"
    },
    "predicted_files": {
      "type": "array",
      "items": {
        "type": "string"
      },
      "description": "List of file paths predicted by idud to be related to the issue"
    },
    "actual_files": {
      "type": "array",
      "items": {
        "type": "string"
      },
      "description": "List of actual file paths that were changed/relevant (ground truth)"
    },
    "precision": {
      "type": "number",
      "minimum": 0,
      "maximum": 1,
      "description": "Precision: TP / (TP + FP)"
    },
    "recall": {
      "type": "number",
      "minimum": 0,
      "maximum": 1,
      "description": "Recall: TP / (TP + FN)"
    },
    "f1": {
      "type": "number",
      "minimum": 0,
      "maximum": 1,
      "description": "F1 Score: 2 * (precision * recall) / (precision + recall)"
    },
    "true_positives": {
      "type": "integer",
      "minimum": 0,
      "description": "Number of correctly predicted related files"
    },
    "false_positives": {
      "type": "integer",
      "minimum": 0,
      "description": "Number of incorrectly predicted related files"
    },
    "false_negatives": {
      "type": "integer",
      "minimum": 0,
      "description": "Number of actual files that were not predicted"
    }
  },
  "required": [
    "run_id",
    "timestamp",
    "repo_url",
    "issue_id",
    "issue_text",
    "predicted_files",
    "actual_files",
    "precision",
    "recall",
    "f1"
  ],
  "additionalProperties": false
}
