{
  "run_id": "550e8400-e29b-41d4-a716-446655440002",
  "timestamp": "2024-07-03T11:20:00Z",
  "repo_url": "https://github.com/hyperium/hyper",
  "batch_id": "batch-20240703-01",
  "issue_id": "issue-http-54321",
  "issue_text": "Optimize HTTP/2 connection pooling",
  "predicted_files": [
    "src/proto/h2/mod.rs",
    "src/client/mod.rs",
    "src/pool.rs",
    "tests/pool_tests.rs"
  ],
  "actual_files": [
    "src/proto/h2/mod.rs",
    "src/client/mod.rs",
    "src/pool.rs"
  ],
  "precision": 1.0,
  "recall": 1.0,
  "f1": 1.0,
  "true_positives": 3,
  "false_positives": 0,
  "false_negatives": 0
}
