{
  "run_id": "550e8400-e29b-41d4-a716-446655440004",
  "timestamp": "2024-07-03T10:14:00Z",
  "repo_url": "https://github.com/serde-rs/serde",
  "batch_id": "batch-202407-02",
  "issue_id": "issue-ser-10002",
  "issue_text": "Improve serde macro expansion performance",
  "predicted_files": [
    "serde_derive/src/lib.rs",
    "serde/src/lib.rs",
    "tests/macros.rs"
  ],
  "actual_files": [
    "serde_derive/src/lib.rs",
    "serde/src/lib.rs"
  ],
  "precision": 0.89,
  "recall": 0.84,
  "f1": 0.86,
  "true_positives": 2,
  "false_positives": 0,
  "false_negatives": 0
}
