{
  "run_id": "550e8400-e29b-41d4-a716-446655440001",
  "timestamp": "2024-07-04T14:30:00Z",
  "repo_url": "https://github.com/tokio-rs/tokio",
  "batch_id": "batch-20240704-01",
  "issue_id": "issue-async-12345",
  "issue_text": "Improve tokio runtime scheduling for high-concurrency scenarios",
  "predicted_files": [
    "tokio/src/runtime/mod.rs",
    "tokio/src/runtime/scheduler/mod.rs",
    "tokio/src/task/mod.rs",
    "tokio/tests/rt_common.rs"
  ],
  "actual_files": [
    "tokio/src/runtime/mod.rs",
    "tokio/src/runtime/scheduler/mod.rs",
    "tokio/src/task/mod.rs"
  ],
  "precision": 1.0,
  "recall": 1.0,
  "f1": 1.0,
  "true_positives": 3,
  "false_positives": 0,
  "false_negatives": 0
}
